{
  "schema_version": 1,
  "episode_id": "EP001",
  "panel_id": "p15-3",
  "status": "evaluating",
  "baseline_image_path": "episodes/EP001/panels/assets/p15-3.png",
  "reference_assets": ["episodes/EP001/characters/assets/chengxin-v1.png", "episodes/EP001/characters/assets/wangmiao-v1.png"],
  "iterations": [{
    "iteration": 1,
    "candidates": [
      { "candidate_id": "p15-3-i1-v1", "variant": 1, "prompt": "Strict two-person staging and black central monitor.", "output_path": ".candidates/EP001/p15-3/iteration-01/p15-3-v01.png", "review_path": "episodes/EP001/panels/convergence/pilot-001/assets/p15-3-a.webp", "reference_assets": ["episodes/EP001/panels/assets/p15-3.png", "episodes/EP001/characters/assets/chengxin-v1.png", "episodes/EP001/characters/assets/wangmiao-v1.png"], "status": "evaluated", "scores": { "character_consistency": 9, "storyboard_fidelity": 10, "composition": 9, "style_consistency": 9, "scene_continuity": 9, "total": 46 }, "diagnosis": "Clear event staging; Cheng Xin gesture is restrained.", "created_at": "2026-08-15T00:00:00.000Z" },
      { "candidate_id": "p15-3-i1-v2", "variant": 2, "prompt": "Doorway tension and emotional continuity.", "output_path": ".candidates/EP001/p15-3/iteration-01/p15-3-v02.png", "review_path": "episodes/EP001/panels/convergence/pilot-001/assets/p15-3-b.webp", "reference_assets": ["episodes/EP001/panels/assets/p15-3.png", "episodes/EP001/characters/assets/chengxin-v1.png", "episodes/EP001/characters/assets/wangmiao-v1.png"], "status": "evaluated", "scores": { "character_consistency": 9, "storyboard_fidelity": 9, "composition": 9, "style_consistency": 9, "scene_continuity": 9, "total": 45 }, "diagnosis": "Stronger gesture; slight glasses rim visibility.", "created_at": "2026-08-15T00:00:00.000Z" }
    ],
    "comparison": { "candidate_order": ["p15-3-i1-v1", "p15-3-i1-v2"], "verdict": "tie", "winner_candidate_id": null, "reason": "Score difference is within the two-point tie margin.", "next_prompt_adjustment": null, "evaluator": "codex-image-review", "evaluated_at": "2026-08-15T00:00:00.000Z" }
  }],
  "selection": { "candidate_id": null, "promoted_path": null, "reason": null, "human_approved": false, "approved_at": null }
}
